{
  "event_schema_version": "ag_generation_audit_event.v1",
  "audit_event_id": "ag-audit-recovery-001",
  "trace_id": "4bf92f3577b34da6a3ce929d0e0e4736",
  "request_id": "0189f0ff-8f22-4f72-9b47-b481dc21bb21",
  "occurred_at": "2026-08-02T00:00:00Z",
  "source_service": "nex-cx",
  "actor_ref": {
    "actor_type": "service",
    "actor_id": "nex-cx",
    "tenant_id": "system"
  },
  "action_type": "retry",
  "target_type": "generation",
  "target_ref": {
    "target_id": "cx-gen-timeout-001",
    "display_summary": "general-llm-default"
  },
  "result_status": "FAILED",
  "quality_summary": {
    "citation_status": null,
    "grounding_required": true,
    "retrieval_package_id": "cx-ret-001",
    "retrieval_package_hash": "dddddddddddddddddddddddddddddddddddddddddddddddddddddddddddddddd",
    "evidence_ref_count": 1
  },
  "compatibility_summary": {
    "compatibility_rule_id": "compat-grounded-answer-v1",
    "grounding_required": true,
    "generation_request_hash": "bbbbbbbbbbbbbbbbbbbbbbbbbbbbbbbbbbbbbbbbbbbbbbbbbbbbbbbbbbbbbbbb",
    "provider_prompt_package_hash": "aaaaaaaaaaaaaaaaaaaaaaaaaaaaaaaaaaaaaaaaaaaaaaaaaaaaaaaaaaaaaaaa"
  },
  "provider_summary": {
    "alias": "general-llm-default",
    "mo_generation_id": null,
    "usage": {},
    "finish_reason": "ERROR",
    "route_id": null,
    "provider_request_id": null,
    "total_ms": null
  },
  "details": {
    "timeline_event_count": 3,
    "artifact_handoff_id": null,
    "recovery_request_id": "ae-recovery-001",
    "requested_action": "retry",
    "policy_hash_status": "MATCHED"
  }
}
